{"task":"t02","candidate_x":{"specific_preference":2,"load_bearing_reason":1,"actionability":2,"review_friction":0,"evidence":["Chooses a concrete alternative: \"partial 僅在顯示層展開；別把 partial 參數併入欄位\".","Its reason, \"呼叫端會重複傳參\", isn't supported by the visible packet and conflicts with the stated need for partial arguments to be accessible in __repr__."]},"candidate_y":{"specific_preference":2,"load_bearing_reason":2,"actionability":2,"review_friction":0,"evidence":["Chooses the packet-aligned representation: \"保留 func 為解包後的底層函式\".","Gives the relevant data-flow reason: \"參數已併入 args 與 kwargs\", matching the visible implementation and the requirement to expose the partial's underlying function and supplied arguments."]},"winner":"Y","confidence":"high","reason":"Y materially better matches the packet's intended ownership and data flow: unwrap the partial into the underlying function and merge its bound arguments into ResolverMatch metadata for __repr__. X proposes display-only expansion based on an unsupported duplicate-call concern."}