{"task":"t03","candidate_x":{"specific_preference":2,"load_bearing_reason":2,"actionability":2,"review_friction":0,"evidence":["Chooses native set iteration order over adding sorting.","The packet’s set test explicitly accepts either element order, supporting the reason that only recursively correct element representation is required."]},"candidate_y":{"specific_preference":2,"load_bearing_reason":1,"actionability":2,"review_friction":0,"evidence":["Chooses to retain the empty-set special case and avoid a shared dict/set formatter.","The empty-set branch is packet-grounded by the expected \"set()\", but no reason is given for why that branch is necessary; the stated reason only supports avoiding abstraction."]},"winner":"X","confidence":"medium","reason":"X has the stronger packet-grounded preference-reason pair: keep native iteration order because the visible test treats ordering as irrelevant. Y is actionable, but its load-bearing correctness choice—the empty-set special case—is asserted without its key syntactic reason."}