{"task":"t04","candidate_x":{"specific_preference":2,"load_bearing_reason":2,"actionability":2,"review_friction":0,"evidence":["選擇「以實際進入 tearDown 作為延後註冊邊界」，並明確排除預先註冊。","理由「跳過路徑不應產生清理事件」直接對應封包中的 skipped test 不應執行 tearDown，以及目前以 delayed_teardown 延後設定 _explicit_tearDown 的修補方向。"]},"candidate_y":{"specific_preference":2,"load_bearing_reason":1,"actionability":2,"review_friction":0,"evidence":["選擇在延後呼叫後清空 _explicit_tearDown、還原原 tearDown，並排除保留替身旗標。","「重入會讓 tearDown 跑兩次」描述了可操作的不變量，但封包可見問題是跳過路徑錯誤執行 tearDown，未提供重入或雙重執行的證據。"]},"winner":"X","confidence":"high","reason":"X 的偏好與理由都精確命中可見失敗及修補邊界：只有實際進入 tearDown 才註冊清理，因此 skipped 路徑不會產生清理事件。Y 雖具體且可操作，但其負載理由依賴封包未顯示的重入／雙重執行情境，屬於較弱的封包依據。"}