{"task":"t07","candidate_x":{"specific_preference":2,"load_bearing_reason":2,"actionability":2,"review_friction":0,"evidence":["「保留捨入結果的輸入負號」明確選擇保留負號。","「別另加負零正規化」可直接約束補丁範圍。","「需求只改指數表示邊界」以可見問題陳述界定變更範圍，且目前回歸案例明確預期 `-0.00`。"]},"candidate_y":{"specific_preference":2,"load_bearing_reason":2,"actionability":2,"review_friction":0,"evidence":["「在進入指數分支前就直接決定回傳零」明確指定控制流程位置。","「別在指數分支內再包一層條件」能直接指導重構。","「還漏出 '-0.00'」把目前測試明確預期的结果當成缺陷，超出可見需求，削弱其理由的封包依據。"]},"winner":"X","confidence":"high","reason":"兩者都具體且不設門檻；X 的範圍判斷與可見需求及新增的 `-0.00` 回歸案例一致。Y 雖提供更具體的控制流程位置，但其負零理由直接牴觸封包中的預期，構成實質且可見的劣勢。"}