{"task":"t05","candidate_x":{"specific_preference":2,"load_bearing_reason":2,"actionability":2,"review_friction":0,"evidence":["「別加 q==1 特例」選擇了方向，但「只由 p、q 子乘積能否求值決定」接近目前補丁已採用的 broadly fallback，沒有清楚指出應如何隔離真正出錯的 Add 分配邏輯。","「只是替上層猜測擦屁股」不是由可見封包建立的具體 invariant 或資料流理由。"]},"candidate_y":{"specific_preference":2,"load_bearing_reason":2,"actionability":2,"review_friction":0,"evidence":["「保留分母為一時的正常乘積求值」直接反對目前 `if q == 1: return None` 的廣泛行為改變。","「錯誤只在加法分配特例」把修補範圍收斂到封包中原本把乘積錯誤轉成各項乘積之和的 Add 分支，能直接指導下一個 patch。"]},"winner":"Y","confidence":"high","reason":"Y 有實質且封包落地的優勢：它同時保住 q==1 的既有正常求值路徑，並把修正定位到造成 `Product(n + 1/2**k, ...)` 錯算的 Add 分配特例。X 雖也反對 q==1 特例，但其替代原則較含混，理由也沒有清楚表達需要維持的語義 invariant。"}